{
  "$schema":"https://json-schema.org/draft/2020-12/schema", "$id":"https://africa-industrial-intelligence.local/schemas/intake.schema.json", "type":"object", "additionalProperties":false,
  "required":["schema_version","id","received_at","media_type","creator","geographies","sectors","commodities","confidentiality","triage_status","checksum"],
  "properties":{"schema_version":{"const":"1.0.0"},"id":{"type":"string","pattern":"^int-[a-z0-9-]+$"},"received_at":{"type":"string","format":"date-time"},"created_at":{"type":["string","null"],"format":"date"},"media_type":{"enum":["pdf","spreadsheet","csv","government-report","research-paper","supplier-quotation","machinery-specification","image","supermarket-photo","packaging-example","consumer-survey","regulatory-document","founder-strategy","api-dataset","other"]},"creator":{"type":"string"},"geographies":{"type":"array","items":{"type":"string"}},"sectors":{"type":"array","items":{"type":"string"}},"commodities":{"type":"array","items":{"type":"string"}},"confidentiality":{"enum":["public","internal","confidential","restricted-personal-data"]},"rights":{"type":"string"},"triage_status":{"enum":["quarantined","catalogued","extracted","reviewed","rejected"]},"checksum":{"type":"string","minLength":1},"reliability_notes":{"type":"string"},"potential_conflicts":{"type":"array","items":{"type":"string"}},"destination":{"type":"string"}}
}
