{"schema_version":"1.0.0","id":"int-REPLACE","received_at":"REPLACE","created_at":null,"media_type":"other","creator":"REPLACE","geographies":[],"sectors":[],"commodities":[],"confidentiality":"internal","rights":"REPLACE","triage_status":"quarantined","checksum":"REPLACE","reliability_notes":"","potential_conflicts":[],"destination":"REPLACE"}
